,Item,Location,Definition
,"Kruskal building cheapest roads - sorts ALL roads by cost, picks cheapest, builds if no cycle, repeats until V-1 roads connect everyone.",,Kruskal's Algorithm: A spanning tree algorithm for minimum spaning trees that sorts all edges by ascending weight, picking the smallest edge and adding it if it doesn't create a cycle, and repeats until there are V - 1 edges.
,"Prim's greedy road building - starts at capital, throws ALL outgoing roads in priority queue by cost, builds cheapest road to new city, adds that city's roads to queue, repeats until entire network built.",,Prim's Algorithm: A minimum spanning tree algorithm that first makes a priority queue with all edges from the start vertex, sorted by their weights, extracts the minimum weight edge from the priority queue, if the edge connects to a vertex not already in the MST, add the vertex to the MST and add all its edges to the priority queue, if the edge connects to a vertex already in the MST, discard the edge, and does this until all vertices are included.
,"Kruskal vs Prim speed: sorting E roads takes ElogE time, Prim's city operations take V² time.",,Kruskal's Algorithm has O(ElogE) time, while Prim's algorithm has O(V^2) time.
,"Exclusive club membership - list of special people with no copies allowed, purely mathematical set concept.",,Set: A collection of distinct objects, called elements or members and contains no duplicates; it is an abstraction of the mathematical concept. In Java, there are HashSet, TreeSet, and LinkedHashSet as built-in classes.
,"Intersection ceremony - two clubs comparing guest lists, keeping only people who showed up to BOTH parties using .retainAll().",,To turn a set into it's intersection with another set, use .retainAll() with the other set.